Name,Pts,Army,Race,Type,Unit,NumUnits,Class,Person,Size,Height,Life,MVE,RGE,ATK,DEF,SP1,SP2,SP3
Krav Maga Agents,100,Vydar,Human,2,Squad,3,Agent,Tricky,Medium,4,1,6,7,3,3,"STEALTH DODGE - When a Krav Maga Agent rolls defense dice against an attacking figure who is not adjacent, one shield will block all damage.",,
Krug,120,Utgar,Troll,2,Hero,1,Beast,Relentless,Huge,8,8,5,1,2,3,"WOUNDED SMASH - When Krug attacks, he receives an extra attack die for each wound marker he has.  ","DOUBLE ATTACK - When Krug attacks, he may attack one additional time.",
Kumiko,80,Jandar,Human,2,Hero,1,Ninja,Tricky,Medium,4,3,6,1,3,5,"Ninjutsu Barrage Special Attack: Range 1. Attack 3. Instead of moving and attacking normally with Kumiko, you may move Kumiko up to 3 spaces. Kumiko can attack up to 3 times with Ninjutsu Barrage Special Attack at any point before, during, or after this move as long as Kumiko is on a space where she could end her movement. Kumiko cannot attack the same figure more than once on a single turn.
Phantom Walk: Kumiko can move through all figures and is never attacked when leaving an engagement.",,
Kurok the Elementalist,120,Utgar,Hobgoblin,2,Hero,1,Sorcerer,Devout,Medium,5,5,5,1,3,3,"Summon Elemental: After moving and before attacking with Kurrok the Elementalist, you may roll the 20-sided die. If you roll an 11 or higher, you may if possible, place one of your previously destroyed small or medium Elementals on an empty space within 3 clear sight spaces of Kurrok the Elementalist.","Master of the Elements: After revealing an order marker on Kurrok the Elementalist, instead of taking that turn with Kurrok, you may take a turn with up to three small or medium Elementals you control that are within 8 clear sight spaces of Kurrok the Elementalist.",
Kyntela Gwyn,20,Ullar,Elf,2,Hero,1,Wizard,Valiant,Medium,4,2,5,1,2,2,Strength of Oak Aura 1: All friendly Elves adjacent to Kyntela Gwyn add 1 to their defense dice.,,
Laglor,110,Vydar,Primadon,2,Hero,1,Alphallon,Precise,Medium,5,6,5,7,3,3,Vydar's Range Enhancement Aura: All friendly figures with a Range number of 4 or more who follow Vydar and are within 4 clear sight spaces of Laglor add 2 to their Range number. Vydar's Range Enhancement Aura does not affect Laglor.,"Autoload Special Attack: Range 7. Attack 3. When attacking with Autoload Special Attack, you may roll Vydar Valkyrie dice. If you roll at least one Vydar symbol, you may attack again using Autoload Special Attack.",
MacDirk Warriors,80,Jandar,Human,0,Squad,4,Warrior,Wild,Medium,5,1,5,1,2,2,"HIGHLAND FURY - At the start of the game, choose a Human Champion you control.  While that champion is in play, MacDirk Warriors roll one additional attack die for each wound marker on the chosen hero.  There can be only one Human Champion for all the MacDirk Warriors you control.  MacDirk Warriors cannot attack their chosen Human Champion.  ","HUMAN CHAMPION BONDING - Before taking a turn with the MacDirk Warriors, you may first take a turn with any Human Champion you control.",
Major Q10,150,Vydar,Soulborg,2,Hero,1,Major,Merciful,Large,6,4,5,8,4,5,Machine Pistol Special Attack: Range 7. Attack 2. Major Q10 may use this special attack 4 times in the same turn. Q10 may target the same figure or a different figure with each attack.,Wrist Rocket Special Attack: Range 4. Attack 4. Major Q10 may use this special attack 2 times in the same turn. Q10 may target the same figure or a different figure with each attack.,
Major Q9,180,Vydar,Soulborg,2,Hero,1,Major,Precise,Large,7,4,5,8,4,7,"Queglix Gun Special Attack - Range 6. Attack 1, 2 or 3.  Major Q9 starts each turn with 9 attack dice. Choose any figure within range and attack by rolling 1, 2 or 3 attack dice.  Major Q9 may keep making special attacks with 1, 2 or 3 attack dice until he has rolled all 9 attack dice. Major Q9 may target the same or different figures with each attack.",,
Major X17,100,Vydar,Soulborg,2,Hero,1,Major,Disciplined,Medium,5,5,5,1,4,3,"Improved Cyberclaw - All small, medium or large opponent's figures that enter or occupy a space adjacent to Major X17 may not move. Figures affected by the Cyberclaw cannot be moved by any special power on an Army Card or Glyph. ","Melee Defense 4 - When rollling defense dice against a normal attack from an adjacent figure, Major X17 adds 4 dice.",
Marcu Esenwein,20,Utgar,Undead,2,Hero,1,Devourer,Terrifying,Medium,4,6,7,1,4,1,"Life Drain: Each time Marcus Esenwein destroys a figure, you may remove a wound marker from this Army Card. Marcu Esenwein cannot Life Drain destructible objects.","Eternal Hatred: After revealing an order marker on this card, you must roll the 20-sided die. If you roll a 17 or higher, choose an opponent. That opponent will now control Marcu Esenwein for the remainder of your turn, but will not be able to view any unrevealed order markers on this card. At the end of that turn, control of Marcu returns to you. All order markers and figures that were on Marcu's Army Card will stay on his Army Card.","Flying: When counting spaces for Marcu Esenwein's movement, ignore elevations. Marcu Esenwein may fly over water without stopping, pass over figures without becoming engaged, and fly over obstacles such as ruins. When Marcu Esenwein starts to fly, if he is engaged he will take any leaving engagement attacks."
Marcus Decimus Gallus,100,Einar,Human,2,Hero,1,Warlord,Disciplined,Medium,5,6,5,1,3,3,SOLDIER LEADERSHIP - All Soldiers you control move one additional space.  ,SOLDIER ATTACK ENHANCEMENT - All friendly Soldiers adjacent to Marcus Decimus Gallus receive an additional attack die.,
Marrden Hounds,90,Utgar,Wulsinu,0,Squad,3,Hunter,Wild,Large,4,1,1,1,3,5,"WILD PACK MOVEMENT - Before moving, roll the 20-sided die.  If you roll a 1-3, add 1 to the move value of this card.  If you roll a 4-5, add 3 to the move value of this card.  If you roll a 7-20, add 7 to the move value of this card. "," MARRO PLAGUE - After moving and before attacking, you must roll the 20-sided die once for each figure adjacent to any Marrden Hounds you control.  If you roll a 16 or higher, that figure receives a wound.  Soulborgs and Wulsinu are not affected by this Marro Plague.",
Marrden Nagrubs,30,Utgar,Nagrubs,0,Squad,3,Guards,Loyal,Small,3,1,6,1,2,2,"Hivelord Life Bonding: Before taking a turn with Marrden Nagrubs, you may first take a turn with any Hivelord you control. Before moving the chosen Hivelord, you may destroy one adjacent Marrden Nagrub you control. If you destroy a Marrden Nagrub with Hivelord Life Bonding remove 1 wound marker from the chosen Hivelord's Army Card.","Climb X2: When moving up or down levels of terrain, Marrden Nagrubs may double their Height.",
Marro Dividers,50,Utgar,Marro,0,Squad,3,Dividers,Wild,Medium,4,1,5,1,3,3,"Cell Divide: When a Marro Divider you control receives one or more wounds from a Normal or Special Attack by an opponent's figure, you may roll the 20-sided die before removing that figure. If you roll a 17 or higher, ignore any wounds that figure just received and, if possible, place one of your previously destroyed Marro Dividers on a same-level space adjacent to the defending Marro Divider.",Self-Replicating: Marro Hive cannot rebirth Marro Dividers with its Marro Rebirth special power.,
Marro Drones,50,Utgar,Marro,0,Squad,3,Drone,Wild,Medium,5,1,6,1,3,3,"HIVE SWARM - Before moving Marro Drones, roll the 20-sided die.  If you roll 1-12, you may move and attack with up to 3 Marro Drones you control.  If you roll a 13-16, you may move and attack with up to 6 Marro Drones you control.  If you roll a 17-20, you may move and attack with up to 9 Marro Drones you control.",,
Marro Drudge,50,Utgar,Marro,0,Squad,3,Hunters,Wild,Medium,4,1,5,5,2,2,"Swamp Water Strength: When a Marro Drudge is on a swamp water space, add 1 to its attack and defense.","Swamp Water Tunnel: If a Marro Drudge ends its normal movement on a swamp water space, you may immediately place it on any empty same-level swamp water space within 5 spaces. If a Marro Drudge is engaged when it starts to tunnel, it will take any leaving engagement attacks.",
Marro Hive,160,Utgar,Marro,2,Hero,1,Hive,Terrifying,Huge,17,6,0,1,1,2,"Hive Mind: After Revealing an order marker on this Army Card, you may take a turn with any small or medium Common Marro Squad you control before taking a turn with Marro Hive. Any figure that is taking a turn must be withing 12 clear sight spaces of Marro Hive prior to its movement.","Marro Rebirth: After taking a turn with Marro Hive, you may roll the 20-sided die. If you roll a 13 or higher, you may place any previously destroyed Common Marro Squad figure from your army on an empty space adjacent to Marro Hive.",
Marro Stingers,60,Utgar,Marro,0,Squad,3,Stingers,Wild,Medium,4,1,5,5,3,3,"Stinger Drain: After moving and before attacking, you may roll the 20-sided die. If you roll a 1-4, you must destroy a Marro Stinger you control and you cannot attack this turn. If you roll a 5 - 9, add 0 to the attack value of this card. If you roll a 10 or higher, add 1 to the attack value of this card.",,
Marro Warriors,50,Utgar,Marro,2,Squad,4,Warrior,Wild,Medium,4,1,6,6,2,3,"WATER CLONE - Instead of attacking with all of the Marro Warriors, one at a time, roll the 20-sided die for each Marro Warrior.  If you roll a 15 or higher, place a previously destroyed Marro Warrior on a same-level space adjacent to that Marro Warrior.  Any Marro Warrior on a water space needs a 10 or higher to Water Clone.  You may only Water Clone after you move.",,
Master of the Hunt,140,Einar,Firbolg,1,Hero,1,Hunter,Bold,Large,6,6,6,4,4,4,"Mortal Strike: After attacking an opponent's Unique Hero with this Master of the Hunt's normal attack, roll 1 attack die for each wound inflicted in that attack. For each additional skull rolled, place 1 additional wound marker on the defending figure's Army Card.","Javelin: After moving and before attacking with this Master of the Hunt, you may roll the 20-sided die. If you roll a 16 or higher, add 3 to this Master of the Hunt's Range value for the duration of its turn.",
Master Win Chiu Woo,140,Aquilla,Human,2,Hero,1,Monk,Disciplined,Medium,5,5,5,1,4,4,Master's Influence: All Monk Squad figures you control may leap an additional 13 levels up or down when using their Stealth Leap special power. All Monks you control within 2 clear sight spaces of Master Woo add 1 to their attack dice and 1 to their defense dice.,Master's Assault: Master Woo may attack any or all figures adjacent to him. Roll each attack separately.,"Stealth Leap 25: Instead of his normal move, Master Woo may use Stealth Leap 25. Stealth Leap 25 has a move of 3. When counting spaces for Stealth Leap 25, ignore elevations. Master Woo may leap over water without stopping, pass over figures without becoming engaged, and leap over obstacles such as ruins. Master Woo may not leap more than 25 levels up or down in a single leap. If Master Woo is engaged when he starts his Stealth Leep 25, he will not take any leaving engagement attacks."
Me-Burq-Sa,50,Utgar,Marro,2,Hero,1,Warlord,Wild,Large,7,3,8,6,3,3,"PARALYZING STARE 16 - After moving and before attacking, choose any small or medium figure within 6 clear site spaces of Me-Burq-Sa.  Roll the 20-sided die.  If you roll a 16 or higher, the chosen figure cannot roll any defense dice if attacked by Me-Burq-Sa this turn.",,
Mezzodemon Warmongers,65,Valkrill,Demon,0,Squad,2,Warmongers,Ferocious,Medium,5,1,5,4,3,3,"Poison Cloud: When a Mezzodemon Warmonger attacks a common figure, add 1 to its Attack value.","Exoskeleton: At the start of the game, place 1 copper Exoskeleton marker on a Mezzodemon Warmongers Army Card for each Mezzodemon Warmonger figure in your army. After a Mezzodemon Warmonger rolls defense dice against a normal attack, you may remove 1 Exoskeleton marker from its Army Card to ignore all wounds inflicted by that attack.",
Microcorp Agents,100,Vydar,Human,0,Squad,3,Agent,Tricky,Medium,5,1,5,7,2,3,"STEALTH ARMOR 15 - When a Microcorp Agent receives one or more wounds, before removing that agent, roll the 20-sided die.  If you roll a 15 or higher, ignore any wounds.  ",WATER SUITS - Microcorp Agents do not have to stop their movement when entering a water space.  Add 2 to a Microcorp Agent's defense while he is on a water space.  ,"SIGHTING - When a Microcorp Agent is attacking with a height advantage, he rolls an additional attack die."
Migol Ironwill,110,Aquilla,Dwarf,2,Hero,1,Leader,Resolute,Small,3,5,5,1,2,4,"Deadly Strike: When attacking with Migol Ironwill, each skull rolled counts as one additional hit.","One Shield Defense: When rolling defense dice, if Migol Ironwill rolls at least one sheild, the most wounds Migol Ironwill can take for this attack is one.","Climb X2: When moving up or down levels of terrain, Migol Ironwill may double his Height."
Mika Connour,110,Vydar,Human,2,Hero,1,Shadow Assasin,Tricky,Medium,5,5,6,1,4,4,"Shadow Ambush: If Mika Connour starts her turn unengaged and on a shadow space, add 3 dice to her attack this turn.","Shadow Dance: If Mika Connour starts her turn on a shadow space, instead of moving normally, you may place her on any other shadow space within 8 spaces of her current location. If Mika Connour is engaged when she starts her Shadow Dance, she will take any leaving engagement attacks.","Blend Into Shadow: Mika Connour starts each game with up to 2 shadow tiles on her Army Card. If Mika Connour ends her turn on an empty land space, you may place a shadow tile from her Army Card onto the space she occupies if the shadow tile fits normally onto that space."
Mimring,150,Utgar,Dragon,2,Hero,1,Beast,Ferocious,Huge,9,5,6,1,4,3,FIRE LINE SPECIAL ATTACK - Range Special.  Attack 4.  Choose 8 spaces in a straight line from Mimring.  All figures on those spaces who are in line of sight are affected by Mimring's Fire Line Special Attack.  Roll 4 attack dice once for all affected figures.  Affected figures roll defense dice separately.  ,"FLYING - When counting spaces for Mimring's movement, ignore elevations.  Mimring may fly over water without stopping, pass over figures without becoming engaged, and fly over obstacles such as ruins.  When Mimring starts to fly, if he is engaged he will take any leaving engagement attacks.",
Mind Flayer Mastermind,100,Utgar,Mind Flayer,1,Hero,1,Psychic,Terrifying,Medium,5,4,5,1,4,4,"Psionic Blast Special Attack: Range 3. Attack 3. This Mind Flayer Mastermind does not need clear line of sight to attack with Psionic Blast Special Attack. If a figure receives 1 or more wounds from Psionic Blast Special Attack, remove one unrevealed order marker at random from that figure's Army Card (or cards if your opponent has more than one Common card for the figure).","Enslave 17: When revealing an order marker on this Mind Flayer Mastermind, after taking this Mind Flayer Mastermind's turn, you may choose any Unique Hero figure within 4 clear sight spaces of this Mind Flayer Mastermind. Roll the 20-sided die. If you roll a 17 or higher, take temporary control of the chosen Hero and immediately take a turn with that Hero. At the end of that turn, control of the chosen Hero returns to its previous owner. All order markers that were on the figure's Army Card will stay on the Army Card. Enslave does not affect Mind Flayers. ",
Minions of Utgar,110,Utgar,Kyrie,0,Squad,3,Minion,Relentless,Medium,6,1,4,1,2,6,"UTGAR'S ORDERS - Instead of taking a turn with Minions of Utgar, you may take a turn with any Kyrie Warrior who follows Utgar.  ",DEADLY STRIKE - When attacking with Minions of Utgar all skulls rolled count for one additional hit.  ,"FLYING - When counting spaces for a Minion of Utgar movement, ignore elevations.  A Minion of Utgar may fly over water without stopping, pass over figures without becoming engaged, and fly over obstacles such as ruins.  When a Minion of Utgar starts to fly if he is engaged he takes leaving engagement attacks."
Mogrimm Forgehammer,120,Aquilla,Dwarf,2,Hero,1,Warlord,Inspiring,Medium,4,6,5,1,4,4,"Combat Leader: If at least one order marker is on Mogrimm Forgehammer, you may add 3 to your initiative roll.","Commander's Strike: After moving and before attacking with Mogrimm Forgehammer, you may choose any opponent's figure within 5 clear site spaces that is engaged with any other figure you control. Roll the 20-sided die. If you roll a 15 or higher, the chosen figure receives 1 wound.
Tough: When rolling defense dice against a normal attack, Mogrimm Forgehammer always adds one automatic shield to whatever is rolled.",
Mohican River Tribe,70,Aquilla,Human,0,Squad,3,Scout,Fearsome,Medium,5,1,5,6,2,1,"Battle Fury: If a Mohican River Tribesman is engaged, add 1 to his attack dice and 2 to his defense dice.","War Cry: After taking a turn with the Mohican River Tribe, if at least two Mohican River Tribesmen you control are engaged, you may immediately take a turn with one Unique Tribesman Hero you control.","Concealment 19: If a Mohican River Tribesman you control is targeted and receives one or more wounds from an attacking figure who is not adjacent, you must roll the 20-sided die. Count the minimum number of spaces between the attacker and the Mohican River Tribesman. Add this number to your die roll. If you roll a 19 or higher, ignore any wounds the Mohican River Tribesman just received."
Moltenclaw,170,Utgar,Dragon,2,Hero,1,Prince,Fearless,Huge,8,6,5,1,5,3,Burning Breath Special Attack: Range 4 + Special. Attack 4. Choose a figure to attack. You may also choose 4 spaces in a straight line from the targeted figure. All figures on those spaces that are within line of sight of Moltenclaw are affected by Burning Breath Special Attack. Roll attack dice once for all affected figures. Each figure rolls defense dice separately. Moltenclaw is not affected by Burning Breath Special Attack.,"Lava Resistant: Moltenclaw never rolls for molten lava damage or lava field damage, and he does not have to stop in molten lava spaces.","Flying: When counting spaces for Moltenclaw's movement, ignore elevations. Moltenclaw may fly over water without stopping, pass over figures without becoming engaged, and fly over obstacles such as ruins. When Moltenclaw starts to fly, if he is engaged he will take any leaving engagement attacks."
Moriko,110,Ullar,Human,2,Hero,1,Ninja,Disciplined,Medium,4,4,6,1,4,4,Phantom Walk: Moriko can move through all figures and is never attacked when leaving an engagement.,"Saber Storm Special Attack: Range 1. Attack 1, 2, or 3. Moriko starts each turn with 6 attack dice. Choose any adjacent figure and attack by rolling 1, 2 or 3 attack dice. Moriko may keep making special attacks with 1, 2 or 3 attack dice until she has rolled all 6 attack dice. Moriko may target the same or different figures with each attack.",
Morsbane,100,Ullar,Elf,2,Hero,1,Wizard,Tricky,Medium,5,6,5,1,3,2,"Rod of Negation - Start the game with 3 brown Negation Markers on this card. At the end of the turn, if you have at least 1 Negation Marker on this card, you may choose any opponent's unique figure within 6 clear sight spaces of Morsbane. Roll the 20-sided die. If you roll a 1-15, nothing happens. If you roll a 16-19, place a Negation Marker on the chosen figure's Army Card. All of that figure's special powers are negated for the entire game. If you roll a 20, destroy the chosen figure.",,
Nakita Agents,120,Vydar,Human,2,Squad,3,Agent,Tricky,Medium,4,1,5,6,3,3,"Smoke Powder 13: When any Nikita Agent you control, or any figure you control that is adjacent to any Nikita agent you control, is targeted for a normal attack from a non‑adjacent opponent, you may roll the 20‑sided die. If you roll a 13 or higher, all Nikita Agents you control and all figures you control that are adjacent to those agents, no longer have any visible hit zones for the duration of the targeting figure's turn. ","Engagement Strike 15: If an opponent's small or medium figure moves adjacent to a Nikita Agent, roll the 20‑sided die. If you roll a 15 or higher, the opponent's figure receives a wound. Figures may be targeted only as they move into engagement with a Nikita Agent. Gorillinator Movement Bonding: Before taking a turn with Nikita Agents, you may move 3 Gorillinators you control up to 7 spaces.",
Ne-Gok-Sa,90,Utgar,Marro,2,Hero,1,Warlord,Tricky,Medium,5,5,5,1,3,6,"MIND SHACKLE 20 - After moving and before attacking, you may choose any unique figure adjacent to Ne-Gok-Sa.  Roll the 20-sided die.  If you roll a 20, take control of the chosen figure and that figure's Army Card.  You now control that Army Card and all figures on it.  Remove any Order Markers on this card.  If Ne-Gok-Sa is destroyed, you retain control of any previously Mind-Shackled Army Cards.",,
Nerak the Glacian Swog Rider,50,Utgar,Orc,2,Hero,1,Champion,Wild,Large,6,3,8,1,3,3,DISENGAGE - Nerak is never attacked when leaving an engagement.  ,ORC DEFENSE AURA 1 - All orc figures you control within 4 clear sight spaces of Nerak add 1 to their defense dice.  Nerak''s Defensive Aura does not affect Nerak.  Snow Strength - Add 1 to Nerak's attack and defense while on a snow space.,
Nilfheim,185,Jandar,Dragon,2,Hero,1,King,Ferocious,Huge,12,6,6,1,6,4,"Ice Shard Breath Special Attack - Range 5. Attack 4. When Nilfheim attacks with his Ice Shard Breath Special Attack, he may attack 2 additional times. He cannot attack the same figure more than once. ","Flying - When counting spaces for Nilfheim's moveoment, ignore elevations.  Nilfheim may fly over water without stopping, pass over figures without becoming engaged, and fly over obstacles such as ruins. When Nilfheim starts to fly, if he is engaged he will take any leaving engagement attacks. ",
Ninjas of the Northern Wind,110,Einar,Human,2,Squad,3,Ninja,Disciplined,Medium,4,1,6,1,4,3,"Disappearing Ninja: If a Ninja of the Northern Wind is attacked with a normal attack and at least 1 skull is rolled, roll the 20‑sided die to disappear. If you roll 1 to 11, roll defensive dice normally. If you roll a 12 or higher, that Ninja of the Northern Wind takes not damage and instead may move up to spaces. Ninjas of the Northern Wind can disappear only if they end their disappearing move not adjacent to any enemy figures. ",Ghost Walk: Ninjas of the Northern Wind can move through all figures. ,Disengage: Ninjas of the Northern Wind are never attacked when leaving an engagement.
Obsidian Guards,100,Utgar,Moltarn,0,Squad,3,Guard,Ferocious,Medium,5,1,4,1,4,4,LAVA RESISTANT - Obsidian Guards never roll for molten lava damage or lava field damage and they do not have to stop on molten lava spaces  ,LAVA THROW - When an Obsidian Guard is on a molten lava space it may add 2 to its range.  ,WATER WEAKNESS - An Obsidian Guard on a water space rolls 2 fewer defense dice.
Ogre Pulverizer,100,Utgar,Ogre,1,Hero,1,Pulverizer,Wild,Large,6,6,5,1,4,3,"Double Attack: When this Ogre Pulverizer attacks, he may attack one additional time.","Lumbering Bully: When attacking with this Ogre Pulverizer, all excess shields rolled by the defending figure count as unblockable hits inflicted by the defending figure on this Ogre Pulverizer.",
Ogre Warhulk,150,Utgar,Ogre,1,Hero,1,Warhulk,Wild,Large,7,8,5,1,5,3,"Flail Hurricane: After moving and before attacking with this Ogre Warhulk, you must roll the 20-sided die. If you roll a 1-10, it may attack normally. If you roll an 11 or higher, instead of attacking normally, it must attack each figure adjacent to it, if possible. Roll each attack separately.","Mine!: When you roll the 20-sided die for a Treasure Glyph trap with this Ogre Warlhulk, you must subtract 4 from your roll.",
Omnicron Repulsors,40,Jandar,Soulborg,0,Squad,3,Repulsors,Precise,Small,3,1,5,7,1,3,"Circuitry Overload: After moving and before attacking, you must roll the 20-sided die once for each Soulborg figure adjacent to any Omnicron Repulsors you control. If the figure is a Squad figure and you roll a 13 or higher, destroy that figure. If the figure is a Hero figure and you roll a 16 or higher, that figure receives a wound. Omnicron Repulsors are not effected by Circuitry Overload.","Targeting Beacon: When attacking a non-adjacent figure, all Soulborg figures you control who follow Jandar add 1 die to their attack if at least one Omnicron Repulsor you control is adjacent to the defending figure.","EMP Response: If an Omnicron Repulsor you control successfully defends against an attack by a Soulborg figure, you must roll the 20-sided die. If you roll a 14 or higher, the attacking figure must immediately end its turn and all order markers must be removed from its Army Card (or cards if your opponent has more than one Common Army Card for the figure)."
Omnicron Snipers,100,Jandar,Soulborg,0,Squad,3,Sniper,Precise,Medium,5,1,5,7,1,3,"DEADLY SHOT - When attacking with Omicron Snipers, all skulls rolled count for one additional hit.",,
Ornak,100,Utgar,Orc,2,Hero,1,Champion,Wild,Medium,5,4,6,1,3,3,"Red Flag of Fury Arua: If order marker 1 is placed on Ornak, then instead of taking that turn with Ornak, you may take a turn with up to 2 Unique Heroes you control who follow Utgar. Ornak cannot be one of the 2 Unique Heroes. Any Unique Hero that is taking a turn instead of Ornak must be within 8 clear sight spaces of Ornak prior to its movement.  ","Orc Battle Cry Aura: When attacking with any Orc Warrior figures you control within 2 clear sight spaces of Ornak, you may roll Utgar Valkyri dice. Each Utgar symbol rolled counts for an additional skull.",
